{
  "$schema": "../../../../contracts/schemas/conformance-case-v1.schema.json",
  "case_version": 1,
  "id": "codex/full",
  "operation": {
    "normalize-letta": {
      "expected": "expected.letta.json",
      "comparison": "json-exact"
    },
    "normalize-canonical": {
      "expected": "expected.canonical.json",
      "comparison": "json-exact"
    }
  },
  "source": "codex",
  "transcript": "input.jsonl",
  "native_container": "codex-rollout-jsonl",
  "source_context": {},
  "bounds": {},
  "filters": {},
  "projection_options": {},
  "mode": "whole",
  "required_capabilities": ["normalize", "typed-diagnostics", "deterministic-rerun"],
  "expected": {
    "result": "diagnostics",
    "diagnostic_codes": ["injected_context_dropped"]
  },
  "comparison": "json-exact"
}
