{
  "$schema": "../../../../contracts/schemas/conformance-case-v1.schema.json",
  "case_version": 1,
  "id": "hermes/tool-calls",
  "operation": {
    "normalize-letta": {
      "expected": "expected.letta.json",
      "comparison": "json-exact"
    },
    "normalize-canonical": {
      "expected": "expected.canonical.json",
      "comparison": "json-exact"
    },
    "project-openai": {
      "expected": "expected.openai.json",
      "comparison": "byte-exact"
    }
  },
  "source": "hermes",
  "transcript": "input.json",
  "native_container": "hermes-session-json",
  "source_context": {},
  "bounds": {},
  "filters": {},
  "projection_options": { "write_indented": false },
  "mode": "whole",
  "required_capabilities": ["normalize", "typed-diagnostics", "deterministic-rerun"],
  "expected": {
    "result": "success",
    "diagnostic_codes": []
  },
  "comparison": "json-exact"
}
