{
  "$schema": "../../../../contracts/schemas/conformance-case-v1.schema.json",
  "case_version": 1,
  "id": "grok-build/backend-later-result",
  "operation": {
    "normalize-letta": {
      "expected": "expected.letta.json",
      "comparison": "json-exact"
    }
  },
  "source": "grok-build",
  "transcript": "input.jsonl",
  "native_container": "grok-build-chat-history-jsonl",
  "source_context": {
    "group_id": "019f0000-0000-7000-8000-0000000000lr"
  },
  "bounds": {},
  "filters": {},
  "projection_options": {},
  "mode": "whole",
  "required_capabilities": ["normalize", "typed-diagnostics", "deterministic-rerun"],
  "expected": {
    "result": "diagnostics",
    "diagnostic_codes": ["timestamps_synthesized"]
  },
  "comparison": "json-exact"
}
